CustomerID,FeedbackText,Rating
CUST-001,"The Pro-Grade Blender is a beast! It's powerful and quiet. Delivery was also incredibly fast, arrived in one day.",5
CUST-002,"My package with the Comfort-Fit Running Shoes arrived damaged, and the box was completely crushed. Disappointed.",2
CUST-003,"I had to return the blender. It was much larger than expected and didn't fit on my counter. The return was easy.",3
CUST-004,"Are the Comfort-Fit shoes waterproof? Need to know before I buy. Your support chat is offline.",3
CUST-005,"Fast shipping is great, but the Pro-Grade Blender's lid doesn't seem to seal properly. Seems like a defect.",2